{
  "$schema": "./schemas/p0-implementation-declaration.schema.v0.1.json",
  "document_id": "TITMAS-INTEGRATIONS-P0-IMPLEMENTATION-DECLARATION-0.1",
  "version": "0.1.0",
  "status": "DEVELOPMENT_POSIX_P0_REFERENCE_IMPLEMENTATION_OFFLINE_TESTS_PASS_NOT_SECURITY_REVIEWED",
  "maturity": "Development",
  "decision_reference": "CS-D02-PRE-67",
  "decision_commit": "aa99c20f40423275a61b732d212751bde2fdca6b",
  "target_parent": "5ac891c5af88b1e9aeacdb3666217c6f832a57a6",
  "platform": {
    "requirement": "POSIX_OS_FORK_WAITPID",
    "observed_local_validation": "Darwin-arm64-macOS-26.5.2-CPython-3.14.5",
    "linux_validated": false,
    "windows_supported": false,
    "cross_platform_support_claim": false
  },
  "public_api": [
    "EndpointBinding",
    "P0ResolverObservation",
    "P0ResolverResult",
    "ResolverFailureCategory",
    "resolve_endpoint",
    "validate_endpoint_continuity"
  ],
  "implementation_files": [
    {
      "path": "src/titmas_integrations/p0_resolver.py",
      "sha256": "8818f11020ceac56db17d738d800f1d7ab3fd16fd3361cc46a8b1ab6a7cec702",
      "role": "P0_PARENT_AND_PUBLIC_CONTRACT"
    },
    {
      "path": "src/titmas_integrations/_p0_resolver_worker.py",
      "sha256": "d28cd2f69d444cb60c41ed56f5945386fbbb02f5671ea7273199caba9183eb11",
      "role": "SINGLE_USE_CHILD_WORKER"
    },
    {
      "path": "src/titmas_integrations/data/__init__.py",
      "sha256": "13ff89d0ff9bcb5fdb06dd9c9373c3595fdfbeda97f2a67b75bfc08127acfa5e",
      "role": "PACKAGE_DATA_BOUNDARY"
    },
    {
      "path": "src/titmas_integrations/data/global-unicast-destination-policy.v1.json",
      "sha256": "945d73ab20026b3bdd15b225d2c37280a2e0efd2f68d7dc597c7674eeb8abba7",
      "role": "DESTINATION_POLICY_MANIFEST"
    },
    {
      "path": "src/titmas_integrations/data/iana-ipv4-special-registry-2025-10-09.csv",
      "sha256": "e3e39e76d00b1677335db8e9a805c7b9480ea2f4dc9e33f0b93cd3a905128d73",
      "role": "FROZEN_IANA_IPV4_INPUT"
    },
    {
      "path": "src/titmas_integrations/data/iana-ipv6-special-registry-2025-10-09.csv",
      "sha256": "775feea0621dec8735a44fbf30f762e721e8f0a1b3ab7eb341961a88cfce2139",
      "role": "FROZEN_IANA_IPV6_INPUT"
    },
    {
      "path": "tests/test_p0_resolver_contract.py",
      "sha256": "2119610001928b1e4ca282bd8048e99e6796dca542fc0bedf33c0d57a9593228",
      "role": "PRE64_POSITIVE_AND_NEGATIVE_MIGRATION"
    },
    {
      "path": "tests/test_p0_resolver_deadline.py",
      "sha256": "6ebbafd8f46c79d183574b848edcf61a5afcb507809f5c6d70b0681377b91e31",
      "role": "WORKER_DEADLINE_AND_IPC_TESTS"
    },
    {
      "path": "tests/test_p0_resolver_security.py",
      "sha256": "3c092da62c0c1d82ecbc8baa31782645c90d810a42547acbb1826d6b522e8156",
      "role": "POLICY_CONTINUITY_AND_SECURITY_BOUNDARY_TESTS"
    }
  ],
  "snapshot_inputs": {
    "policy_id": "GLOBAL_UNICAST_DESTINATION_PROFILE_V1",
    "source_last_updated": "2025-10-09",
    "license": "CC0-1.0",
    "ipv4_sha256": "e3e39e76d00b1677335db8e9a805c7b9480ea2f4dc9e33f0b93cd3a905128d73",
    "ipv6_sha256": "775feea0621dec8735a44fbf30f762e721e8f0a1b3ab7eb341961a88cfce2139"
  },
  "test_result": {
    "command": "PYTHONDONTWRITEBYTECODE=1 PYTHONPATH=src python3 -m unittest discover -s tests -v",
    "tests_run": 92,
    "existing_tests": 30,
    "new_tests": 62,
    "failures": 0,
    "errors": 0,
    "real_dns_calls": 0,
    "real_tcp_calls": 0,
    "tls_handshakes": 0,
    "http_requests": 0,
    "status": "PASS"
  },
  "build_result": {
    "command": "uv build --offline --out-dir <fresh-temporary-directory>",
    "status": "PASS_OFFLINE_TEMPORARY_ARTIFACTS_NOT_PUBLISHED",
    "artifact_published": false,
    "snapshot_data_in_wheel": true,
    "warning": "SETUPTOOLS_LICENSE_METADATA_DEPRECATION_OPEN"
  },
  "capability_truth": {
    "p0_resolver_reference_implementation_created": true,
    "bounded_dns_capability_implemented": true,
    "real_network_executed_during_validation": false,
    "p1_tcp_implemented": false,
    "p2_tls_implemented": false,
    "provider_binding_created": false,
    "runtime_created": false
  },
  "security_boundaries": {
    "success_admission_deadline_ms": 5000,
    "total_wall_clock_upper_bound_claim": false,
    "ipc_payload_bytes_max": 512,
    "selected_address_count_max": 1,
    "credential_environment_allowed": false,
    "inherited_file_descriptors_allowed": false,
    "retry_allowed": false,
    "fallback_allowed": false,
    "p1_reresolution_allowed": false,
    "endpoint_binding_persisted": false,
    "multithreaded_fork_safety_established": false,
    "formal_security_review_complete": false
  },
  "known_limitations": [
    "DEVELOPMENT_REFERENCE_IMPLEMENTATION_ONLY",
    "PUBLIC_P0_FUNCTION_NOT_REAL_NETWORK_VALIDATED",
    "TOTAL_WALL_CLOCK_ABSOLUTE_BOUND_NOT_CLAIMED",
    "POSIX_FORK_REQUIRED",
    "LINUX_NOT_VALIDATED",
    "WINDOWS_NOT_SUPPORTED",
    "NATIVE_THREAD_AND_EXTENSION_FORK_SAFETY_NOT_ESTABLISHED",
    "SINGLE_ADDRESS_NO_FAILOVER",
    "P1_P2_NOT_IMPLEMENTED",
    "NO_PROVIDER_BINDING_OR_SUPPORT",
    "NO_FORMAL_SECURITY_REVIEW",
    "NOT_RELEASED"
  ],
  "effects": {
    "authority_created": false,
    "permission_granted": false,
    "evidence_created": false,
    "evidence_truth_changed": false,
    "provider_supported": false,
    "provider_conformance_executed": false,
    "formal_security_review_completed": false,
    "release_authorized": false,
    "commercial_availability": "NOT_CLAIMED"
  }
}
